{
  "annotation_schema_version": "1.0",
  "video_id": "jug_b1_004",
  "filename": "52349e85-5b9a-4c5a-88f8-793e10c72cb8.mp4",
  "upload_source": "app_gallery_upload",
  "capture_device": "unknown",
  "duration_seconds": 10.60,
  "original_resolution": "1080x1920",
  "processed_resolution": "406x720",
  "fps": 30.0,
  "original_rotation_metadata": 0,
  "display_orientation": "portrait",
  "checksum_sha256": "1505807097bff756cbc75059030da48c0cd8864ff28e3ab127f3afd76edcb065",
  "annotation_status": "metadata_ready",
  "annotation_version": "v1.0",

  "privacy_review_status": "pending",
  "ownership_confirmed": null,
  "consent_confirmed": null,
  "recognizable_third_party_present": null,
  "minor_present": null,
  "external_source": null,

  "difficulty": null,
  "total_juggling_count": null,
  "count_confidence": null,
  "dominant_body_part": null,
  "body_parts_used": null,
  "ball_visible_quality": null,
  "lighting_quality": null,
  "camera_stability": null,
  "multi_person_present": null,
  "multiple_balls_present": null,
  "expected_validity": null,
  "invalidity_reason": null,
  "notes": null,
  "annotator": null,
  "second_annotator": null,
  "second_annotator_count": null,
  "inter_annotator_agreement": null,
  "annotation_date": null,
  "contact_events": null
}
