{
  "annotation_schema_version": "1.0",
  "video_id": "jug_b1_001",
  "filename": "d9ffe19a-f143-4458-a816-0a408c211e39.mp4",
  "upload_source": "app_gallery_upload",
  "capture_device": "unknown",
  "duration_seconds": 11.19,
  "original_resolution": "888x1920",
  "processed_resolution": "1556x720",
  "fps": 36.835,
  "original_rotation_metadata": 90,
  "display_orientation": "landscape",
  "checksum_sha256": "631a7febf22f780f4725c34bd001c213a003cccbdd705d329b177ffdf1f13c93",
  "annotation_status": "metadata_ready",
  "annotation_version": "v1.0",

  "privacy_review_status": "pending",
  "ownership_confirmed": null,
  "consent_confirmed": null,
  "recognizable_third_party_present": null,
  "minor_present": null,
  "external_source": null,

  "difficulty": null,
  "total_juggling_count": null,
  "count_confidence": null,
  "dominant_body_part": null,
  "body_parts_used": null,
  "ball_visible_quality": null,
  "lighting_quality": null,
  "camera_stability": null,
  "multi_person_present": null,
  "multiple_balls_present": null,
  "expected_validity": null,
  "invalidity_reason": null,
  "notes": null,
  "annotator": null,
  "second_annotator": null,
  "second_annotator_count": null,
  "inter_annotator_agreement": null,
  "annotation_date": null,
  "contact_events": null
}
